wireshark with tcpdump
root㉿kali)-[~]
└─# ifconfig          
eth0: flags=4163<UP,BROADCAST,RUNNING,MULTICAST>  mtu 1500
        inet 192.168.5.128  netmask 255.255.255.0  broadcast 192.168.5.255
        inet6 fe80::20c:29ff:fea4:bb4b  prefixlen 64  scopeid 0x20<link>
        ether 00:0c:29:a4:bb:4b  txqueuelen 1000  (Ethernet)
        RX packets 1072  bytes 118961 (116.1 KiB)
        RX errors 0  dropped 0  overruns 0  frame 0
        TX packets 844  bytes 102377 (99.9 KiB)
        TX errors 0  dropped 0 overruns 0  carrier 0  collisions 0

lo: flags=73<UP,LOOPBACK,RUNNING>  mtu 65536
        inet 127.0.0.1  netmask 255.0.0.0
        inet6 ::1  prefixlen 128  scopeid 0x10<host>
        loop  txqueuelen 1000  (Local Loopback)
        RX packets 8  bytes 480 (480.0 B)
        RX errors 0  dropped 0  overruns 0  frame 0
        TX packets 8  bytes 480 (480.0 B)
        TX errors 0  dropped 0 overruns 0  carrier 0  collisions 0

                                                                             
┌──(root㉿kali)-[~]
└─# tcpdump -i eth0 -s0
tcpdump: verbose output suppressed, use -v[v]... for full protocol decode
listening on eth0, link-type EN10MB (Ethernet), snapshot length 262144 bytes
21:56:28.585604 ARP, Request who-has 192.168.5.2 tell 192.168.5.1, length 46
21:56:28.621094 IP 192.168.5.128.41083 > 192.168.5.2.domain: 35307+ PTR? 2.5.168.192.in-addr.arpa. (42)
21:56:28.626730 ARP, Request who-has 192.168.5.128 tell 192.168.5.2, length 46
21:56:28.626739 ARP, Reply 192.168.5.128 is-at 00:0c:29:a4:bb:4b (oui Unknown), length 28
21:56:28.626820 IP 192.168.5.2.domain > 192.168.5.128.41083: 35307 NXDomain 0/0/0 (42)
21:56:28.626949 IP 192.168.5.128.36424 > 192.168.5.2.domain: 35280+ PTR? 1.5.168.192.in-addr.arpa. (42)
21:56:28.630352 IP 192.168.5.2.domain > 192.168.5.128.36424: 35280 NXDomain 0/0/0 (42)
21:56:28.723488 IP 192.168.5.128.55763 > 192.168.5.2.domain: 16086+ PTR? 128.5.168.192.in-addr.arpa. (44)
21:56:28.731830 IP 192.168.5.2.domain > 192.168.5.128.55763: 16086 NXDomain 0/0/0 (44)
21:56:29.724592 ARP, Request who-has 192.168.5.2 tell 192.168.5.1, length 46
21:56:30.589698 ARP, Request who-has 192.168.5.2 tell 192.168.5.1, length 46
21:56:31.581145 ARP, Request who-has 192.168.5.2 tell 192.168.5.1, length 46
21:56:33.714563 ARP, Request who-has 192.168.5.2 tell 192.168.5.128, length 28
21:56:33.715258 ARP, Reply 192.168.5.2 is-at 00:50:56:fc:7a:55 (oui Unknown), length 46
21:56:36.563419 IP 192.168.5.1 > 192.168.5.128: ICMP echo request, id 1, seq 128, length 40
21:56:36.563447 IP 192.168.5.128 > 192.168.5.1: ICMP echo reply, id 1, seq 128, length 40
21:56:37.260866 ARP, Request who-has 192.168.5.2 tell 192.168.5.1, length 46
21:56:37.568492 IP 192.168.5.1 > 192.168.5.128: ICMP echo request, id 1, seq 129, length 40
21:56:37.568513 IP 192.168.5.128 > 192.168.5.1: ICMP echo reply, id 1, seq 129, length 40
21:56:38.090660 ARP, Request who-has 192.168.5.2 tell 192.168.5.1, length 46
21:56:38.582877 IP 192.168.5.1 > 192.168.5.128: ICMP echo request, id 1, seq 130, length 40
21:56:38.582922 IP 192.168.5.128 > 192.168.5.1: ICMP echo reply, id 1, seq 130, length 40
21:56:39.078076 ARP, Request who-has 192.168.5.2 tell 192.168.5.1, length 46
21:56:39.589739 IP 192.168.5.1 > 192.168.5.128: ICMP echo request, id 1, seq 131, length 40
22:01:28.580598 ARP, Request who-has 192.168.5.2 tell 192.168.5.1, length 46
22:01:29.734007 ARP, Request who-has 192.168.5.2 tell 192.168.5.1, length 46
22:01:30.579544 ARP, Request who-has 192.168.5.2 tell 192.168.5.1, length 46
22:01:31.580353 ARP, Request who-has 192.168.5.2 tell 192.168.5.1, length 46
22:01:37.264784 ARP, Request who-has 192.168.5.2 tell 192.168.5.1, length 46
22:01:38.082172 ARP, Request who-has 192.168.5.2 tell 192.168.5.1, length 46
22:01:39.078794 ARP, Request who-has 192.168.5.2 tell 192.168.5.1, length 46
22:01:40.278454 ARP, Request who-has 192.168.5.2 tell 192.168.5.1, length 46
22:01:41.079860 ARP, Request who-has 192.168.5.2 tell 192.168.5.1, length 46
22:01:42.082623 ARP, Request who-has 192.168.5.2 tell 192.168.5.1, length 46
22:01:46.307582 ARP, Request who-has 192.168.5.2 tell 192.168.5.1, length 46
22:01:47.082410 ARP, Request who-has 192.168.5.2 tell 192.168.5.1, length 46
22:01:48.090155 ARP, Request who-has 192.168.5.2 tell 192.168.5.1, length 46
22:01:49.323587 ARP, Request who-has 192.168.5.2 tell 192.168.5.1, length 46
22:01:50.077081 ARP, Request who-has 192.168.5.2 tell 192.168.5.1, length 46
22:01:51.092793 ARP, Request who-has 192.168.5.2 tell 192.168.5.1, length 46
^C
165 packets captured
165 packets received by filter
0 packets dropped by kernel
